<?xml version="1.0" encoding="UTF-8"?>
<!ELEMENT dia (letraCentral, letra+, palabra+)>
<!ATTLIST dia
    id CDATA #REQUIRED
>
<!ELEMENT letraCentral (#PCDATA)>
<!ELEMENT letra (#PCDATA)>
<!ELEMENT palabra (contenido, palabreto?)>
<!ATTLIST palabra
    long CDATA #REQUIRED
>
<!ELEMENT contenido (#PCDATA)>
<!ELEMENT palabreto EMPTY>